keluhan;bagian
Saya sudah membayar EPRT tapi status di igracias masih belum di update, mohon bantuannya;PUSAT BAHASA
tolong adakan EPRT online agar mempermudah dalam proses pengetesan EPRT;PUSAT BAHASA
Saya sudah mencoba membayar bpp melalui atm maupun teller namun ada gangguan ke rek telkomnya, saya memakai rek mandiri Terimakasih;AKUNTANSI
Selamat siang, saya mau menanyakan bagaimana perihal pengalihan uang bpp saya dari semester 3 ke semester 4. Terima kasih;AKUNTANSI
Koleksi buku seni yang sangat sedikit tolong di perbanyak;OPEN LIBRARY
Kurangnya stop kontak untuk pengunjung dan stop kontak yang sudah ada beberapa tidak berfungsi;OPEN LIBRARY
saya mengalami kesulitan dalam membayar Eprt di m-banking mandiri, mohon bantuannya;PUSAT BAHASA
